<?xml version="1.0" encoding="UTF-8"?>
<xs:schema xmlns:xs="http://www.w3.org/2001/XMLSchema"
        xmlns:thing-description="http://eclipse.org/smarthome/schemas/thing-description/v1.0.0"
        xmlns:config-description="http://eclipse.org/smarthome/schemas/config-description/v1.0.0"
        targetNamespace="http://eclipse.org/smarthome/schemas/thing-description/v1.0.0">

    <xs:import namespace="http://eclipse.org/smarthome/schemas/config-description/v1.0.0"
            schemaLocation="http://eclipse.org/smarthome/schemas/config-description-1.0.0.xsd"/>

    <xs:element name="thing-descriptions">
        <xs:complexType>
            <xs:choice minOccurs="1" maxOccurs="unbounded">
                <xs:element name="thing-type" type="thing-description:thingType"/>
                <xs:element name="bridge-type" type="thing-description:bridgeType"/>
                <xs:element name="channel-type" type="thing-description:channelType"/>
            </xs:choice>
            <xs:attribute name="bindingId" type="xs:string" use="required"/>
        </xs:complexType>
    </xs:element>

    <xs:complexType name="thingType">
        <xs:sequence>
            <xs:element name="supported-bridge-type-refs" type="thing-description:supportedBridgeTypeRefs" minOccurs="0"/>
            <xs:element name="label" type="xs:string"/>
            <xs:element name="description" type="xs:string" minOccurs="0"/>
            <xs:element name="channels" type="thing-description:channels" minOccurs="0"/>
            <xs:choice minOccurs="0">
                <xs:element name="config-description" type="config-description:configDescription"/>
                <xs:element name="config-description-ref" type="config-description:configDescriptionRef"/>
            </xs:choice>
        </xs:sequence>
        <xs:attribute name="id" type="xs:string" use="required"/>
    </xs:complexType>

    <xs:complexType name="supportedBridgeTypeRefs">
        <xs:sequence>
            <xs:element name="bridge-type-ref" type="thing-description:bridgeTypeRef" minOccurs="1" maxOccurs="unbounded"/>
        </xs:sequence>
    </xs:complexType>

    <xs:complexType name="bridgeTypeRef">
        <xs:attribute name="id" type="xs:string" use="required"/>
    </xs:complexType>

    <xs:complexType name="channels">
        <xs:sequence>
            <xs:element name="channel" type="thing-description:channel" minOccurs="1" maxOccurs="unbounded"/>
        </xs:sequence>
    </xs:complexType>

    <xs:complexType name="bridgeType">
        <xs:complexContent>
            <xs:extension base="thing-description:thingType"/>
        </xs:complexContent>
    </xs:complexType>

    <xs:complexType name="channel">
        <xs:attribute name="id" type="xs:string" use="required"/>
        <xs:attribute name="typeId" type="xs:string" use="required"/>
    </xs:complexType>

    <xs:complexType name="channelType">
        <xs:sequence>
            <xs:element name="item-type" type="xs:string"/>
            <xs:element name="label" type="xs:string"/>
            <xs:element name="description" type="xs:string" minOccurs="0"/>
            <xs:choice minOccurs="0">
                <xs:element name="config-description" type="config-description:configDescription"/>
                <xs:element name="config-description-ref" type="config-description:configDescriptionRef"/>
            </xs:choice>
        </xs:sequence>
        <xs:attribute name="id" type="xs:string" use="required"/>
    </xs:complexType>

</xs:schema>
