<?xml version="1.0" encoding="UTF-8"?>
<thing:thing-descriptions bindingId="ble" xmlns:xsi="http://www.w3.org/2001/XMLSchema-instance"
	xmlns:thing="http://eclipse.org/smarthome/schemas/thing-description/v1.0.0"
	xsi:schemaLocation="http://eclipse.org/smarthome/schemas/thing-description/v1.0.0 http://eclipse.org/smarthome/schemas/thing-description-1.0.0.xsd">

	<!-- Sample Thing Type -->
	<thing-type id="yeelight_blue2" listed="false">
		<label>YeeLightBlue II Light Bulb</label>
		<description></description>

		<channels>
			<channel id="switch" typeId="switch">
			</channel>

			<channel id="brightness" typeId="brightness">
			</channel>

			<channel id="color" typeId="color">
			</channel>

			<channel id="rssi" typeId="rssi">
			</channel>
		</channels>

		<properties>
			<property name="bleFilter">NAME=Yeelight Blue II</property>
		</properties>

		<config-description>
			<parameter name="ble_address" type="text">
				<label>BLE Address</label>
				<description>Bluetooth address in XX:XX:XX:XX:XX:XX format</description>
			</parameter>
		</config-description>

	</thing-type>


	<!-- RSSI Channel -->
	<channel-type id="rssi">
		<item-type>Number</item-type>
		<label>RSSI</label>
		<description>The RSSI channel provides the current receive signal strength of the device</description>
		<category>QualityOfService</category>
	</channel-type>

	<!-- Color Channel -->
	<channel-type id="color">
		<item-type>Color</item-type>
		<label>Color</label>
		<description>The color channel allows to control the color of a light.
            It is also possible to dim values and switch the light on and off.
        </description>
		<category>ColorLight</category>
	</channel-type>

	<!-- Brightness Channel -->
	<channel-type id="brightness">
		<item-type>Dimmer</item-type>
		<label>Brightness</label>
		<description>The brightness channel allows to control the brightness of a light.
            It is also possible to switch the light on and off.
        </description>
		<category>DimmableLight</category>
	</channel-type>

	<!-- Switch Channel -->
	<channel-type id="switch">
		<item-type>Switch</item-type>
		<label>Switch</label>
		<description>Switch the light on and off</description>
		<category>Light</category>
	</channel-type>

</thing:thing-descriptions>
