<?xml version="1.0" encoding="UTF-8"?>
<thing:thing-descriptions bindingId="${bindingId}"
						  xmlns:xsi="http://www.w3.org/2001/XMLSchema-instance"
						  xmlns:thing="http://eclipse.org/smarthome/schemas/thing-description/v1.0.0"
						  xsi:schemaLocation="http://eclipse.org/smarthome/schemas/thing-description/v1.0.0 http://eclipse.org/smarthome/schemas/thing-description-1.0.0.xsd">

	<!-- Sample Thing Type -->
	<thing-type id="sample">
		<label>${bindingIdCamelCase} Binding Thing</label>
		<description>Sample thing for ${bindingIdCamelCase} Binding</description>

		<channels>
			<channel id="channel1" typeId="sample-channel"/>
		</channels>
	</thing-type>

	<!-- Sample Channel Type -->
	<channel-type id="sample-channel">
		<item-type>${bindingId}Item</item-type>
		<label>${bindingIdCamelCase} Binding Channel</label>
		<description>Sample channel for ${bindingIdCamelCase} Binding</description>
	</channel-type>

</thing:thing-descriptions>
