<?xml version="1.0" encoding="UTF-8"?>
<thing:thing-descriptions bindingId="digitalstrom" xmlns:xsi="http://www.w3.org/2001/XMLSchema-instance"
    xmlns:thing="http://eclipse.org/smarthome/schemas/thing-description/v1.0.0"
    xsi:schemaLocation="http://eclipse.org/smarthome/schemas/thing-description/v1.0.0 http://eclipse.org/smarthome/schemas/thing-description-1.0.0.xsd"
>

    <!--DigitalStrom Bridge -->
    <bridge-type id="dssBridge">
        <label>@text/DSS_BRIDGE_LABEL</label>
        <description>@text/DSS_BRIDGE_DESC</description>
        <channels>
            <channel typeId="totalActivePower" id="totalActivePower" />
            <channel typeId="totalElectricMeter" id="totalElectricMeter" />
        </channels>
        <properties>
            <property name="serverCert"></property>
        </properties>
        <config-description-ref uri="binding:digitalstrom:dssBridge" />
    </bridge-type>

</thing:thing-descriptions>
