<?xml version="1.0" encoding="UTF-8"?>
<thing:thing-descriptions bindingId="hue"
    xmlns:xsi="http://www.w3.org/2001/XMLSchema-instance"
    xmlns:thing="http://eclipse.org/smarthome/schemas/thing-description/v1.0.0"
    xsi:schemaLocation="http://eclipse.org/smarthome/schemas/thing-description/v1.0.0 http://eclipse.org/smarthome/schemas/thing-description-1.0.0.xsd">

    <!-- Generic ZigBee LightLink Bulb -->
    <thing-type id="ZLL_Light">
        <supported-bridge-type-refs>
            <bridge-type-ref id="bridge" />
        </supported-bridge-type-refs>

        <label>ZigBee LightLink Bulb</label>
        <description>This is a generic ZigBee LightLink Bulb</description>

        <channels>
            <channel id="brightness" typeId="brightness" />
        </channels>

        <config-description>
            <parameter name="lightId" type="text">
                <label>Light ID</label>
                <description>The light identifier identifies one certain light.</description>
                <required>true</required>
            </parameter>
        </config-description>
    </thing-type>
</thing:thing-descriptions>
