<?xml version="1.0" encoding="UTF-8"?>
<thing:thing-descriptions bindingId="hue"
	xmlns:xsi="http://www.w3.org/2001/XMLSchema-instance"
	xmlns:thing="http://eclipse.org/smarthome/schemas/thing-description/v1.0.0"
	xsi:schemaLocation="http://eclipse.org/smarthome/schemas/thing-description/v1.0.0 http://eclipse.org/smarthome/schemas/thing-description-1.0.0.xsd">

	<!-- Generic thing for color lights (ZigBee Device ID: 0x0200) -->
	<thing-type id="color_light">
		<supported-bridge-type-refs>
			<bridge-type-ref id="bridge" />
		</supported-bridge-type-refs>

		<label>Hue supported color lights</label>
		<description>Supports all color lights</description>

		<channels>
			<channel id="color" typeId="color" />
			<channel id="brightness" typeId="brightness" />
			<channel id="alert" typeId="alert" />
			<channel id="effect" typeId="effect" />
		</channels>

		<config-description>
			<parameter name="lightId" type="text">
				<label>Light ID</label>
				<description>The light identifier identifies one certain hue light.</description>
				<required>true</required>
			</parameter>
		</config-description>
	</thing-type>
</thing:thing-descriptions>
