<?xml version="1.0" encoding="UTF-8"?>
<thing:thing-descriptions bindingId="lifx" xmlns:xsi="http://www.w3.org/2001/XMLSchema-instance"
    xmlns:thing="http://eclipse.org/smarthome/schemas/thing-description/v1.0.0"
    xsi:schemaLocation="http://eclipse.org/smarthome/schemas/thing-description/v1.0.0 http://eclipse.org/smarthome/schemas/thing-description-1.0.0.xsd">

    <!-- LIFX Light -->
    <thing-type id="light">
        <label>LIFX Light</label>

        <channels>
            <channel id="color" typeId="color" />
        </channels>

        <config-description>
            <parameter name="deviceId" type="text" required="true">
                <label>LIFX device ID</label>
            </parameter>
        </config-description>
        
    </thing-type>

    <!-- Color Channel -->
    <channel-type id="color">
        <item-type>Color</item-type>
        <label>Color</label>
        <description>Selects the color of the light</description>
        <category>ColorLight</category>
    </channel-type>

</thing:thing-descriptions>
